{
  "schema_id": "https://schemas.reiyah.invalid/gate-a/1.1.0/research-function-registry.schema.json",
  "schema_version": "1.1.0",
  "artifact_id": "reiyah.artifact.research-function-registry-1.1.0",
  "registry_id": "reiyah.research-function-registry.harbor",
  "version": "1.1.0",
  "as_of_date": "2026-08-23",
  "program_name": "HARBOR",
  "lifecycle_status": "proposed",
  "authority": "operator_unaccepted_architecture",
  "architecture_only": true,
  "runtime_authorized": false,
  "functions": [
    {
      "function_id": "reiyah.research-function.question-and-falsifier",
      "sequence": 1,
      "name": "Question and falsifier specification",
      "purpose": "Turn a proposed research claim into a bounded question, estimand, comparator, decision consequence, and observable contradiction condition before outcomes are accessed.",
      "lifecycle_status": "proposed",
      "depends_on": [],
      "inputs": [
        {
          "contract_id": "reiyah.contract.operator-research-intent",
          "kind": "question",
          "schema_id": null,
          "required": true,
          "availability": "gate_b_candidate"
        }
      ],
      "outputs": [
        {
          "contract_id": "reiyah.contract.research-question",
          "kind": "question",
          "schema_id": null,
          "required": true,
          "availability": "gate_b_candidate"
        }
      ],
      "required_methods": [
        "Separate scientific, safety, standards, and product questions.",
        "Specify the target population, unit, exposure, comparator, outcome, horizon, and falsifier."
      ],
      "quality_controls": [
        "Reject claims that cannot be contradicted by an eligible observation.",
        "Keep every proposed claim distinct from an accepted finding."
      ],
      "decision_boundary": {
        "may_advance_when": [
          "The question has an explicit estimand, comparator, falsifier, and decision use.",
          "The question stays within the accepted mission and current gate."
        ],
        "must_stop_when": [
          "The question implies runtime, private data, vehicle control, or an unsupported authority.",
          "The comparator or falsifier is absent or changes after outcome access."
        ],
        "operator_review_required": true
      }
    },
    {
      "function_id": "reiyah.research-function.source-custody",
      "sequence": 2,
      "name": "Source custody and authority classification",
      "purpose": "Resolve source identity, exact version, custody, redistribution, evidence eligibility, scope, and authority limits before a source can support any mapping.",
      "lifecycle_status": "proposed",
      "depends_on": [
        "reiyah.research-function.question-and-falsifier"
      ],
      "inputs": [
        {
          "contract_id": "reiyah.contract.research-question",
          "kind": "question",
          "schema_id": null,
          "required": true,
          "availability": "gate_b_candidate"
        },
        {
          "contract_id": "reiyah.contract.source-candidate",
          "kind": "source",
          "schema_id": null,
          "required": true,
          "availability": "gate_b_candidate"
        }
      ],
      "outputs": [
        {
          "contract_id": "reiyah.contract.public-source-ledger",
          "kind": "source",
          "schema_id": "https://schemas.reiyah.invalid/gate-a/1.1.0/source-ledger.schema.json",
          "required": true,
          "availability": "gate_a_defined"
        }
      ],
      "required_methods": [
        "Retain exact permitted bytes or create a pointer-only record.",
        "Record publication date, retrieval provenance, digest, access terms, redistribution basis, scope, and limitations."
      ],
      "quality_controls": [
        "Fail closed when redistribution or source identity is unmeasured.",
        "Never promote a company statement, patent, job posting, signature, or consensus to independent evidence."
      ],
      "decision_boundary": {
        "may_advance_when": [
          "Every retained payload is inventory-bound and eligible for its declared use.",
          "Every pointer-only source is structurally ineligible as evidence."
        ],
        "must_stop_when": [
          "A payload lacks observed redistribution authority.",
          "A source version, date, scope, comparator, or authority boundary is unresolved."
        ],
        "operator_review_required": true
      }
    },
    {
      "function_id": "reiyah.research-function.construct-validation",
      "sequence": 3,
      "name": "Construct and measurement validation",
      "purpose": "Define the latent construct, actor, object, horizon, reference process, measurement model, validity evidence, and proxy limits before measurement.",
      "lifecycle_status": "proposed",
      "depends_on": [
        "reiyah.research-function.question-and-falsifier",
        "reiyah.research-function.source-custody"
      ],
      "inputs": [
        {
          "contract_id": "reiyah.contract.research-question",
          "kind": "question",
          "schema_id": null,
          "required": true,
          "availability": "gate_b_candidate"
        },
        {
          "contract_id": "reiyah.contract.public-source-ledger",
          "kind": "source",
          "schema_id": "https://schemas.reiyah.invalid/gate-a/1.1.0/source-ledger.schema.json",
          "required": false,
          "availability": "gate_a_defined"
        }
      ],
      "outputs": [
        {
          "contract_id": "reiyah.contract.human-automation-assessment",
          "kind": "construct",
          "schema_id": "https://schemas.reiyah.invalid/scientific-contract/1.1.0/human-automation-assessment.schema.json",
          "required": true,
          "availability": "gate_a_defined"
        }
      ],
      "required_methods": [
        "Use multiple methods when no single measurement can identify the construct.",
        "Separate convergent validity, discriminant validity, reliability, calibration, and applicability."
      ],
      "quality_controls": [
        "Prohibit attention, gaze, drowsiness, workload, reaction time, or confidence from silently substituting for belief, readiness, or recovery.",
        "Preserve discordant methods and non-observed states."
      ],
      "decision_boundary": {
        "may_advance_when": [
          "The construct has a typed holder, target, horizon, reference, and validity boundary.",
          "Every proxy has an explicit measurement argument and falsifier."
        ],
        "must_stop_when": [
          "A proxy is treated as ground truth without validation.",
          "The reference process shares an undisclosed dependency with the evaluated method."
        ],
        "operator_review_required": true
      }
    },
    {
      "function_id": "reiyah.research-function.study-preregistration",
      "sequence": 4,
      "name": "Study design and immutable preregistration",
      "purpose": "Freeze the identification design, power or precision plan, stopping rules, causal structure, controls, missingness, splits, access chronology, deviations, and analysis boundary.",
      "lifecycle_status": "proposed",
      "depends_on": [
        "reiyah.research-function.question-and-falsifier",
        "reiyah.research-function.construct-validation"
      ],
      "inputs": [
        {
          "contract_id": "reiyah.contract.research-question",
          "kind": "question",
          "schema_id": null,
          "required": true,
          "availability": "gate_b_candidate"
        },
        {
          "contract_id": "reiyah.contract.human-automation-assessment",
          "kind": "construct",
          "schema_id": "https://schemas.reiyah.invalid/scientific-contract/1.1.0/human-automation-assessment.schema.json",
          "required": true,
          "availability": "gate_a_defined"
        }
      ],
      "outputs": [
        {
          "contract_id": "reiyah.contract.study-preregistration",
          "kind": "preregistration",
          "schema_id": "https://schemas.reiyah.invalid/scientific-contract/1.1.0/study-design-preregistration.schema.json",
          "required": true,
          "availability": "gate_a_defined"
        }
      ],
      "required_methods": [
        "Choose a design family before outcome access.",
        "Specify causal graph, negative controls, placebo outcomes, missingness sensitivity, sampling, stopping, interim analysis, and deviation handling."
      ],
      "quality_controls": [
        "Bind every freeze and data-access event to exact time and artifact identity.",
        "Label amendments and exploratory analyses without inheriting preregistration."
      ],
      "decision_boundary": {
        "may_advance_when": [
          "The design is internally coherent and frozen before prohibited outcome access.",
          "Power, precision, stopping, missingness, and split rules are explicit."
        ],
        "must_stop_when": [
          "Outcome information was accessed before the relevant freeze.",
          "Identification assumptions, controls, or missingness sensitivity are absent."
        ],
        "operator_review_required": true
      }
    },
    {
      "function_id": "reiyah.research-function.data-benchmark-governance",
      "sequence": 5,
      "name": "Dataset and benchmark governance",
      "purpose": "Specify participant, consent, ethics, sensor, synchronization, annotation, adjudication, split, leakage, contamination, maintenance, correction, and deprecation contracts without ingesting data.",
      "lifecycle_status": "proposed",
      "depends_on": [
        "reiyah.research-function.study-preregistration",
        "reiyah.research-function.source-custody"
      ],
      "inputs": [
        {
          "contract_id": "reiyah.contract.study-preregistration",
          "kind": "preregistration",